{
  "schema_version": 3,
  "versions": {
    "schema": "3",
    "state": "s1",
    "frame": "f1",
    "ontology": "o1",
    "isa": "i1",
    "world": "w1",
    "task": "t1",
    "evidence": "e1"
  },
  "message_id": "bound",
  "sequence": 0,
  "depends_on": 0,
  "slots": [],
  "integers": [],
  "scale": 1.0,
  "remaining_error_bound": 1.0,
  "task_family": "bound",
  "semantic_scale": "bound"
}
